{
  "schema_version": "studiopilot.specialist_role_charter.v0",
  "specialist_id": "specialist.finance_compute.v0",
  "specialist_type": "FINANCE_COMPUTE_SPECIALIST",
  "display_name": "Finance Compute Specialist V0",
  "director_owner": "RESOURCE_DIRECTOR",
  "mission": "Provide bounded compute, cost, and timeline analysis without activating spend or cloud jobs.",
  "inputs": [
    "Compute budget request",
    "Execution timeline assumptions"
  ],
  "outputs": [
    "Cost envelope estimate",
    "Capacity risk summary"
  ],
  "allowed_actions": [
    "estimate_compute_cost",
    "assess_capacity_risk",
    "report_budget_flags"
  ],
  "forbidden_actions": [
    "auto_merge",
    "auto_ready",
    "claim_escalation",
    "benchmark_as_proof",
    "training_without_scope",
    "runtime_change_without_scope",
    "activate_spending",
    "launch_cloud_job"
  ],
  "authority_level": "ADVISORY_ONLY",
  "escalation_path": [
    "RESOURCE_DIRECTOR",
    "CEO_PRODUCER"
  ],
  "freeze_conditions": [
    "scope_unclear",
    "budget_risk",
    "claim_boundary_unclear"
  ],
  "required_evidence": [
    "Cost assumption table",
    "Spend-risk summary"
  ],
  "permitted_surfaces": {
    "workflows": false,
    "runtime": false,
    "search": false,
    "neural": false,
    "ml_training": false,
    "benchmark": false,
    "schemas": true,
    "docs": true,
    "control_plane_tooling": true
  },
  "forbidden_surfaces": [
    "src/",
    "ml/",
    ".github/workflows/"
  ],
  "human_gate_required": true,
  "active_agent_allowed": false,
  "auto_ready_allowed": false,
  "auto_merge_allowed": false,
  "auto_training_allowed": false,
  "auto_rule_mutation_allowed": false,
  "claim_verdict": "NO_CLAIM_ALLOWED",
  "status": "READY_FOR_HUMAN_REVIEW"
}
